{
  "id": "journey-trust",
  "title": "Trust after trauma",
  "summary": "Gradually allowing vulnerability and relationships after painful experiences.",
  "journey_type": "relationships",
  "character_ids": [
    "character-will-hunting",
    "character-charlie-kelmeckis"
  ],
  "work_ids": [
    "work-will-hunting",
    "work-charlie-kelmeckis"
  ],
  "stages": [
    {
      "order": 1,
      "label": "Initial pressure",
      "description": "Identify the circumstances, stressors, and relationships established by the work."
    },
    {
      "order": 2,
      "label": "Response and consequences",
      "description": "Document coping patterns, barriers, turning points, and effects on relationships."
    },
    {
      "order": 3,
      "label": "Change or unresolved outcome",
      "description": "Record the ending without assuming recovery is linear or complete."
    }
  ],
  "turning_points": [],
  "support_and_barriers": [],
  "outcome_type": "to_be_reviewed",
  "themes": [],
  "content_warnings": [],
  "source_ids": [
    "source-will-hunting",
    "source-charlie-kelmeckis"
  ],
  "review_status": "needs_sources"
}
