{
  "id": "journey-representation",
  "title": "Alienation and harmful representation",
  "summary": "A contested portrayal for examining stigma, social exclusion, and the risk of equating mental illness with violence.",
  "journey_type": "representation",
  "character_ids": [
    "character-arthur-fleck"
  ],
  "work_ids": [
    "work-arthur-fleck"
  ],
  "stages": [
    {
      "order": 1,
      "label": "Initial pressure",
      "description": "Identify the circumstances, stressors, and relationships established by the work."
    },
    {
      "order": 2,
      "label": "Response and consequences",
      "description": "Document coping patterns, barriers, turning points, and effects on relationships."
    },
    {
      "order": 3,
      "label": "Change or unresolved outcome",
      "description": "Record the ending without assuming recovery is linear or complete."
    }
  ],
  "turning_points": [],
  "support_and_barriers": [],
  "outcome_type": "to_be_reviewed",
  "themes": [],
  "content_warnings": [],
  "source_ids": [
    "source-arthur-fleck"
  ],
  "review_status": "needs_sources"
}
