{
  "id": "journey-accountability",
  "title": "Accountability and repeated patterns",
  "summary": "A nonlinear arc in which coping patterns cause harm and change requires accountability.",
  "journey_type": "accountability",
  "character_ids": [
    "character-bojack-horseman",
    "character-diane-nguyen"
  ],
  "work_ids": [
    "work-bojack-horseman",
    "work-diane-nguyen"
  ],
  "stages": [
    {
      "order": 1,
      "label": "Initial pressure",
      "description": "Identify the circumstances, stressors, and relationships established by the work."
    },
    {
      "order": 2,
      "label": "Response and consequences",
      "description": "Document coping patterns, barriers, turning points, and effects on relationships."
    },
    {
      "order": 3,
      "label": "Change or unresolved outcome",
      "description": "Record the ending without assuming recovery is linear or complete."
    }
  ],
  "turning_points": [],
  "support_and_barriers": [],
  "outcome_type": "to_be_reviewed",
  "themes": [],
  "content_warnings": [],
  "source_ids": [
    "source-bojack-horseman",
    "source-diane-nguyen"
  ],
  "review_status": "needs_sources"
}
