{
  "id": "journey-belonging",
  "title": "Belonging and identity",
  "summary": "Negotiating expectations and building a sense of self through relationships, skills, and community.",
  "journey_type": "identity",
  "character_ids": [
    "character-mirabel-madrigal",
    "character-miles-morales",
    "character-luz-noceda"
  ],
  "work_ids": [
    "work-mirabel-madrigal",
    "work-miles-morales",
    "work-luz-noceda"
  ],
  "stages": [
    {
      "order": 1,
      "label": "Initial pressure",
      "description": "Identify the circumstances, stressors, and relationships established by the work."
    },
    {
      "order": 2,
      "label": "Response and consequences",
      "description": "Document coping patterns, barriers, turning points, and effects on relationships."
    },
    {
      "order": 3,
      "label": "Change or unresolved outcome",
      "description": "Record the ending without assuming recovery is linear or complete."
    }
  ],
  "turning_points": [],
  "support_and_barriers": [],
  "outcome_type": "to_be_reviewed",
  "themes": [],
  "content_warnings": [],
  "source_ids": [
    "source-mirabel-madrigal",
    "source-miles-morales",
    "source-luz-noceda"
  ],
  "review_status": "needs_sources"
}
